{"run":20,"commit":"a651b23","metric":35.082,"metrics":{"split_ms":25.855,"signature_ms":9.228,"produced_pct":100,"diversity_score":0.416474,"balance_error_pct":0,"rate_limit_failures":0},"status":"keep","description":"Increase input-generation and signature-generation request row caps from 16 to 18; the larger requests reduce round-trips further and improve total throughput while preserving validation, diversity, and balance behavior.","timestamp":1783049706728,"segment":0,"confidence":5.6379196840026315,"asi":{"hypothesis":"The input and signature paths still have batching headroom at 18 rows per request, and round-trip savings continue to dominate prompt-size overhead.","quality_preservation":"Only request row caps changed; duplicate filtering, validation, balancing, diversity prompting, and fallback behavior are unchanged.","learned":["total_ms improved from 37.449ms to 35.082ms","split_ms improved from 28.360ms to 25.855ms","signature_ms rose slightly from 9.089ms to 9.228ms but overall gain was strong","quality and rate-limit metrics remained stable"],"next_action_hint":"Probe 20 rows cautiously or consider asymmetric caps for input vs signature mode if one path starts flattening sooner than the other."}}
{"run":21,"commit":"4e12102","metric":34.871,"metrics":{"split_ms":25.637,"signature_ms":9.234,"produced_pct":100,"diversity_score":0.416474,"balance_error_pct":0,"rate_limit_failures":0},"status":"keep","description":"Increase input-generation and signature-generation request row caps from 18 to 20; batching still improves total throughput, mainly through faster split/input-side progress, while preserving validation and quality behavior.","timestamp":1783049738829,"segment":0,"confidence":5.621758277605609,"asi":{"hypothesis":"The input and signature generation paths still have usable batching headroom at 20 rows per request, and the round-trip reduction outweighs any prompt growth costs.","quality_preservation":"Only request row caps changed; duplicate filtering, validation, balancing, diversity prompting, and fallback behavior are unchanged.","learned":["total_ms improved from 35.082ms to 34.871ms","split_ms improved from 25.855ms to 25.637ms","signature_ms stayed effectively flat","quality and rate-limit metrics remained stable"],"next_action_hint":"Either probe 22 rows cautiously or consider asymmetric caps since signature mode appears flatter than split/input-side gains."}}
