{"type":"config","name":"Optimize AutoData generation for speed, rate-limit safety, and quality","metricName":"total_ms","metricUnit":"ms","bestDirection":"lower"}
{"run":1,"commit":"26b98f4","metric":69.338,"metrics":{"split_ms":50.139,"signature_ms":19.199,"produced_pct":100,"diversity_score":0.416474,"balance_error_pct":0,"rate_limit_failures":5},"status":"keep","description":"Baseline AutoData benchmark with mocked DSPy workloads covering split and signature generation, output balancing, and simulated rate-limit pressure.","timestamp":1783048588055,"segment":0,"confidence":null,"asi":{"hypothesis":"Current pipeline likely wastes time in duplicate detection, oversized request bursts, and oversample rewrite behavior.","benchmark_workload":"mocked split+signature AutoData generation with simulated safe concurrency of 4","observed_bottlenecks":["rate_limit_failures=5 from oversized parallel bursts","split mode dominates runtime","quality baseline already achieves full production and zero balance error"]}}
{"run":2,"commit":"26b98f4","metric":63.268,"metrics":{"split_ms":46.572,"signature_ms":16.696,"produced_pct":100,"diversity_score":0.416474,"balance_error_pct":0,"rate_limit_failures":0},"status":"checks_failed","description":"Tried bounded in-flight request batching plus cached fingerprints and deferred balanced writes; benchmark improved strongly but a new test was invalid and checks failed.","timestamp":1783048792705,"segment":0,"confidence":null,"asi":{"hypothesis":"Capping concurrent request bursts, avoiding O(n^2) duplicate scans, and skipping intermediate oversample writes should improve speed and reduce rate-limit failures.","rollback_reason":"New test used a predictor that always returned the same row, so duplicate filtering prevented reaching n and caused a false failure.","next_action_hint":"Reapply the code changes, fix the test to emit unique rows, and rerun benchmark.","learned":"The code-path changes benchmark well: total_ms 69.338 -> 63.268 and simulated rate_limit_failures 5 -> 0 before revert."}}
{"run":3,"commit":"0bda26a","metric":63.382,"metrics":{"split_ms":46.457,"signature_ms":16.925,"produced_pct":100,"diversity_score":0.416474,"balance_error_pct":0,"rate_limit_failures":0},"status":"keep","description":"Add safer bounded in-flight request batching, cache row fingerprints for O(1) duplicate detection, defer oversample writes until final balanced selection, and prefer higher-quality ties during balanced subsampling.","timestamp":1783048927564,"segment":0,"confidence":52.24561403508896,"asi":{"hypothesis":"AutoData can be both faster and safer by capping burst concurrency, eliminating repeated duplicate scans, and avoiding wasted oversample disk writes.","rate_limit_strategy":"new max_inflight_requests cap (default 4) bounds burst size independently from local thread count","quality_preservation":"kept validation/duplication checks; balanced selection now prefers higher-quality rows on ties","learned":["Simulated rate-limit failures dropped from 5 to 0","Total benchmark improved from 69.338ms to 63.382ms","Split mode gained most from the changes"]}}
{"run":4,"commit":"0bda26a","metric":63.796,"metrics":{"split_ms":47.13,"signature_ms":16.666,"produced_pct":100,"diversity_score":0.416474,"balance_error_pct":0,"rate_limit_failures":0},"status":"discard","description":"Tried caching field specs, validators, and predictor scaffolding on AutoData instances to reduce Python overhead, but the measured gain was not better than the current best.","timestamp":1783049022964,"segment":0,"confidence":22.5606060606061,"asi":{"hypothesis":"Memoizing validators/specs/predictors may shave Python overhead in repeated generation stages.","rollback_reason":"Benchmark regressed versus the kept bounded-concurrency/fingerprint/write-deferral version (63.796ms vs 63.382ms).","next_action_hint":"Try structural output-generation changes, especially reducing fallback calls or improving batch failure recovery.","learned":"Caching scaffolding had negligible or negative effect in this workload; main wins likely already came from request budgeting and avoiding wasted work."}}
{"run":5,"commit":"0bda26a","metric":63.749,"metrics":{"split_ms":46.979,"signature_ms":16.77,"produced_pct":100,"diversity_score":0.416474,"balance_error_pct":0,"rate_limit_failures":0},"status":"discard","description":"Retested batched write_rows plus balanced-final write_rows usage to check whether the small apparent improvement was real; rerun landed worse than the current kept result, so treat it as noise.","timestamp":1783049074878,"segment":0,"confidence":16.22888283378726,"asi":{"hypothesis":"Batch-appending rows with a single fsync may slightly reduce output rewrite overhead.","rollback_reason":"Follow-up run did not beat the kept version; observed gain appears within noise for this workload.","next_action_hint":"Focus next on changes that reduce model-call structure or signature-mode write overhead, not micro-IO tweaks alone.","learned":"write_rows batching may help marginally, but the effect was not stable enough to keep over the existing bounded-concurrency win."}}
{"run":6,"commit":"45e0f23","metric":60.865,"metrics":{"split_ms":46.604,"signature_ms":14.261,"produced_pct":100,"diversity_score":0.416474,"balance_error_pct":0,"rate_limit_failures":0},"status":"keep","description":"Batch multi-row dataset writes with a single append/fsync and use batched writes for signature-mode acceptance and final balanced rewrites, cutting persistence overhead without weakening validation or quality gates.","timestamp":1783049138412,"segment":0,"confidence":32.09469696969702,"asi":{"hypothesis":"Persistence overhead still matters, especially in signature mode where rows were fsynced one-by-one.","write_strategy":"write_rows now appends JSONL/CSV/parquet batches efficiently; signature mode accumulates accepted rows per parsed batch before writing","quality_preservation":"row validation, duplicate filtering, and balancing behavior unchanged","learned":["Signature-mode time dropped materially (16.925ms -> 14.261ms vs kept version)","Total benchmark improved to 60.865ms with rate_limit_failures still 0","This resembles DataDesigner-style staged batching while keeping DSPy semantics"]}}
{"run":7,"commit":"55bf9c0","metric":57.665,"metrics":{"split_ms":43.427,"signature_ms":14.238,"produced_pct":100,"diversity_score":0.416474,"balance_error_pct":0,"rate_limit_failures":0},"status":"keep","description":"Batch accepted output-row persistence in split mode so batch successes and single-row fallbacks are appended once per iteration instead of fsyncing each accepted row individually.","timestamp":1783049188463,"segment":0,"confidence":28.19565217391293,"asi":{"hypothesis":"Split-mode output generation still pays unnecessary per-row persistence overhead; buffering accepted rows per iteration should improve throughput without changing validation or fallback semantics.","quality_preservation":"Acceptance logic, validation, duplicate handling, and fallback behavior are unchanged; only write batching changed.","learned":["total_ms improved from 60.865ms to 57.665ms","split_ms saw the main gain (46.604ms -> 43.427ms)","rate_limit_failures remained 0 and quality metrics stayed flat"],"next_action_hint":"Next promising path is structural retry improvement for output generation, e.g. re-batching failed outputs through smaller batches before single-item fallback."}}
{"run":8,"commit":"55bf9c0","metric":58.04,"metrics":{"split_ms":43.567,"signature_ms":14.473,"produced_pct":100,"diversity_score":0.416474,"balance_error_pct":0,"rate_limit_failures":0},"status":"discard","description":"Tried replacing full pending-list re-filtering in split output generation with incremental next_pending tracking to reduce list churn, but it did not beat the current best.","timestamp":1783049236511,"segment":0,"confidence":7.965199590583422,"asi":{"hypothesis":"Avoiding repeated full pending list reconstruction should reduce Python overhead in output generation loops.","rollback_reason":"Benchmark regressed slightly versus the kept version (58.040ms vs 57.665ms), so the change is not worth keeping.","next_action_hint":"Try a more structural output retry improvement, such as smaller-batch retries before single-row fallback, or target signature-mode setup overhead.","learned":"The existing simple pending-index filtering is already efficient enough relative to other costs in this workload."}}
{"run":9,"commit":"55bf9c0","metric":57.728,"metrics":{"split_ms":43.534,"signature_ms":14.194,"produced_pct":100,"diversity_score":0.416474,"balance_error_pct":0,"rate_limit_failures":0},"status":"discard","description":"Tried chunk-level batched persistence in signature mode to reduce write frequency further, but it did not beat the current best overall result.","timestamp":1783049291456,"segment":0,"confidence":4.857677902621723,"asi":{"hypothesis":"Accumulating accepted signature-mode rows across the whole chunk before writing may trim fsync overhead further.","rollback_reason":"Primary metric was slightly worse than the kept best (57.728ms vs 57.665ms), so this is not a clear win.","next_action_hint":"Pursue structural output retry improvements next, especially smaller-batch retries before single-row fallback, or add a benchmark scenario that exercises partial output failures without weakening quality constraints.","learned":"Signature-mode write batching may be near its local optimum already; additional batching gave only a tiny, non-winning change."}}
{"run":10,"commit":"55bf9c0","metric":57.858,"metrics":{"split_ms":43.543,"signature_ms":14.315,"produced_pct":100,"diversity_score":0.416474,"balance_error_pct":0,"rate_limit_failures":0},"status":"discard","description":"Tried smaller-batch output retries before single-row fallback to better handle partial batch failures in real APIs, but it slightly regressed on the current benchmark.","timestamp":1783049337029,"segment":0,"confidence":4.055941626129254,"asi":{"hypothesis":"A staged retry ladder (full batch -> smaller retry batches -> single-row fallback) should reduce expensive single-call fallback in partial-failure scenarios without weakening quality checks.","rollback_reason":"Current benchmark does not exercise partial output failures, so the extra retry path added overhead without improving the primary metric (57.858ms vs best 57.665ms).","next_action_hint":"Either add a representative partial-output-failure benchmark scenario and reinitialize, or focus on always-hot paths like generator setup, signature-mode validation, or configurable durability tradeoffs.","learned":"The retry-ladder idea remains plausible for production resilience, but it is not justified by the present benchmark target."}}
{"run":11,"commit":"d746443","metric":57.369,"metrics":{"split_ms":43.086,"signature_ms":14.284,"produced_pct":100,"diversity_score":0.416474,"balance_error_pct":0,"rate_limit_failures":0},"status":"keep","description":"Remove redundant split-output write de-dup bookkeeping: each pending index is only accepted once per iteration, so the extra written_indices set was unnecessary overhead on the hot path.","timestamp":1783049376144,"segment":0,"confidence":4.083589218696692,"asi":{"hypothesis":"The split output hot path can be simplified further by removing bookkeeping that no longer protects any real duplicate-write case.","quality_preservation":"Validation, fallback behavior, produced rows, diversity, and balance semantics are unchanged; only redundant per-acceptance state tracking was removed.","learned":["total_ms improved from 57.665ms to 57.369ms","split_ms saw the win (43.427ms -> 43.086ms)","rate_limit_failures remained 0 with no quality regressions"],"next_action_hint":"Keep targeting always-hot per-row overhead in output and signature acceptance loops before pursuing benchmark-cold resilience paths."}}
{"run":12,"commit":"d746443","metric":58.488,"metrics":{"split_ms":44.143,"signature_ms":14.345,"produced_pct":100,"diversity_score":0.416474,"balance_error_pct":0,"rate_limit_failures":0},"status":"discard","description":"Tried removing growth of the seed-row bookkeeping lists in input and signature generation now that duplicate detection uses fingerprint sets, but it regressed on the benchmark.","timestamp":1783049420208,"segment":0,"confidence":5.5424866867330245,"asi":{"hypothesis":"Avoiding appends to now-redundant seed bookkeeping lists should reduce hot-path overhead in input and signature generation.","rollback_reason":"Primary metric regressed versus the kept best (58.488ms vs 57.369ms), so the simplification is not paying off in this workload.","next_action_hint":"Focus next on tighter per-row validation/parsing overhead or benchmark-visible setup costs rather than removing minor list bookkeeping.","learned":"Some apparently redundant list state may still interact favorably with current Python execution patterns; not all simplifications are wins."}}
{"run":13,"commit":"7816fff","metric":50.556,"metrics":{"split_ms":36.01,"signature_ms":14.546,"produced_pct":100,"diversity_score":0.416474,"balance_error_pct":0,"rate_limit_failures":0},"status":"keep","description":"Increase split output-generation batch size from the old 10-row cap to a moderate 16-row cap, reducing model round-trips while keeping validation, fallback, and quality checks unchanged.","timestamp":1783049461501,"segment":0,"confidence":7.901556583929313,"asi":{"hypothesis":"The split output path is still round-trip bound; a moderately larger typed output batch should improve throughput without changing data semantics.","quality_preservation":"No validation or balancing logic changed; only the number of rows requested per output batch increased to a still-conservative 16.","learned":["total_ms improved from 57.369ms to 50.556ms","split_ms improved sharply from 43.086ms to 36.010ms","signature_ms stayed roughly flat, confirming the win is concentrated in split output batching"],"next_action_hint":"Probe whether similarly moderate batching wins exist elsewhere, but avoid pushing batch sizes so high that real prompt size or partial-failure risk would outweigh the gain."}}
{"run":14,"commit":"bd515e9","metric":49.747,"metrics":{"split_ms":35.489,"signature_ms":14.258,"produced_pct":100,"diversity_score":0.416474,"balance_error_pct":0,"rate_limit_failures":0},"status":"keep","description":"Increase split output-generation batch cap again from 16 to 20 rows; this further reduces round-trips on the hot typed-batch path while preserving all validation and fallback behavior.","timestamp":1783049485268,"segment":0,"confidence":5.152136752136743,"asi":{"hypothesis":"The split output path still benefits from a slightly larger but still moderate batch cap, with throughput gains outweighing batching overhead.","quality_preservation":"Only batch size changed; validation, balancing, duplicate handling, and fallback semantics are unchanged.","learned":["total_ms improved from 50.556ms to 49.747ms","split_ms improved from 36.010ms to 35.489ms","quality and rate-limit metrics remained stable"],"next_action_hint":"Continue probing the split output batch-size frontier cautiously; stop once gains flatten or regress to avoid overfitting or unrealistic prompt growth."}}
{"run":15,"commit":"76eb4ba","metric":49.712,"metrics":{"split_ms":35.422,"signature_ms":14.29,"produced_pct":100,"diversity_score":0.416474,"balance_error_pct":0,"rate_limit_failures":0},"status":"keep","description":"Increase split output-generation batch cap from 20 to 24 rows; the larger typed batch still improves the hot split-output path slightly without changing validation or fallback behavior.","timestamp":1783049511041,"segment":0,"confidence":3.754016832440701,"asi":{"hypothesis":"There is still a little headroom in split output batching before prompt-size or failure risk dominates.","quality_preservation":"Only the typed output batch cap changed; validation, balancing, duplicate handling, and fallback semantics are unchanged.","learned":["total_ms improved slightly from 49.747ms to 49.712ms","split_ms improved marginally from 35.489ms to 35.422ms","quality and rate-limit metrics stayed flat"],"next_action_hint":"One more cautious probe of the batch-size frontier may be worthwhile, but stop quickly if gains flatten or reverse to avoid overfitting."}}
{"run":16,"commit":"76eb4ba","metric":50.104,"metrics":{"split_ms":35.815,"signature_ms":14.288,"produced_pct":100,"diversity_score":0.416474,"balance_error_pct":0,"rate_limit_failures":0},"status":"discard","description":"Probed a higher split output-generation batch cap of 28 rows to find the batching frontier, but it regressed versus the current best.","timestamp":1783049536371,"segment":0,"confidence":3.65066964285714,"asi":{"hypothesis":"A somewhat larger typed output batch might still reduce round-trips enough to beat the 24-row cap.","rollback_reason":"Primary metric regressed versus the kept 24-row cap (50.104ms vs 49.712ms), indicating the batching frontier has likely been crossed.","next_action_hint":"Stop increasing the split output batch cap; pivot to other hot-path overheads or at most confirm 24 with a rerun if needed.","learned":"24 rows appears near the sweet spot for the current workload; pushing to 28 adds enough overhead or prompt cost to lose the gain."}}
{"run":17,"commit":"a4f50b4","metric":42.157,"metrics":{"split_ms":30.485,"signature_ms":11.672,"produced_pct":100,"diversity_score":0.416474,"balance_error_pct":0,"rate_limit_failures":0},"status":"keep","description":"Raise per-request row caps for input generation and signature-mode generation from 10 to a moderate 12 rows, reducing round-trips on both always-hot generation paths while preserving validation and diversity checks.","timestamp":1783049585247,"segment":0,"confidence":4.9205286024619825,"asi":{"hypothesis":"Input and signature generation are still round-trip bound; modestly larger row counts per request should improve throughput similarly to the split output batching win without pushing prompts to extreme sizes.","quality_preservation":"Only request row caps changed; duplicate filtering, validation, balancing, diversity prompts, and fallback behavior are unchanged.","learned":["total_ms improved from 49.712ms to 42.157ms","split_ms improved from 35.422ms to 30.485ms","signature_ms improved from 14.290ms to 11.672ms","rate_limit_failures remained 0 and output quality metrics stayed flat"],"next_action_hint":"Probe whether 12 is the new sweet spot or whether a small further increase in input/signature row caps still helps before prompt-size costs dominate."}}
{"run":18,"commit":"b6e2228","metric":42.078,"metrics":{"split_ms":30.443,"signature_ms":11.635,"produced_pct":100,"diversity_score":0.416474,"balance_error_pct":0,"rate_limit_failures":0},"status":"keep","description":"Increase input-generation and signature-generation request row caps from 12 to 14; the modestly larger requests further reduce round-trips while preserving validation, diversity, and balance behavior.","timestamp":1783049629529,"segment":0,"confidence":4.722390645300994,"asi":{"hypothesis":"The input and signature paths still have a bit more batching headroom beyond 12 rows per request before prompt-size costs dominate.","quality_preservation":"Only request row caps changed; duplicate filtering, validation, balancing, diversity prompting, and fallback behavior are unchanged.","learned":["total_ms improved from 42.157ms to 42.078ms","split_ms improved from 30.485ms to 30.443ms","signature_ms improved from 11.672ms to 11.635ms","quality and rate-limit metrics remained stable"],"next_action_hint":"One more cautious probe of these row caps may be worthwhile, but stop quickly if gains flatten to benchmark noise or reverse."}}
{"run":19,"commit":"6238fe6","metric":37.449,"metrics":{"split_ms":28.36,"signature_ms":9.089,"produced_pct":100,"diversity_score":0.416474,"balance_error_pct":0,"rate_limit_failures":0},"status":"keep","description":"Increase input-generation and signature-generation request row caps from 14 to 16; the larger but still moderate requests sharply reduce round-trips on both hot generation paths while preserving validation and diversity behavior.","timestamp":1783049676215,"segment":0,"confidence":5.296296296296295,"asi":{"hypothesis":"The input and signature paths still have meaningful batching headroom at 16 rows per request, and round-trip savings will outweigh any prompt-size overhead.","quality_preservation":"Only request row caps changed; duplicate filtering, validation, balancing, diversity prompting, and fallback behavior are unchanged.","learned":["total_ms improved from 42.078ms to 37.449ms","split_ms improved from 30.443ms to 28.360ms","signature_ms improved strongly from 11.635ms to 9.089ms","quality and rate-limit metrics remained stable"],"next_action_hint":"Continue cautiously probing this batching frontier, but confirm the next step carefully because prompt-size cliffs may appear quickly beyond this point."}}
